{
  "schema": "luminous-technology-services-opsbench-economic-cost-v0.1",
  "version": 1,
  "binding": {
    "run_id": "example-run-0001",
    "arm_id": "luminous-human-approved",
    "episode_id": "example-episode-0001",
    "currency": "USD",
    "rate_card_digest": "sha256:aaaaaaaaaaaaaaaaaaaaaaaaaaaaaaaaaaaaaaaaaaaaaaaaaaaaaaaaaaaaaaaa",
    "allocation_policy_digest": "sha256:bbbbbbbbbbbbbbbbbbbbbbbbbbbbbbbbbbbbbbbbbbbbbbbbbbbbbbbbbbbbbbbb"
  },
  "components": [
    {
      "category": "model_runtime",
      "status": "measured",
      "amount_microusd": 100,
      "evidence_record_digest": "sha256:1111111111111111111111111111111111111111111111111111111111111111"
    },
    {
      "category": "connector_api",
      "status": "measured",
      "amount_microusd": 50,
      "evidence_record_digest": "sha256:2222222222222222222222222222222222222222222222222222222222222222"
    },
    {
      "category": "compute_infrastructure",
      "status": "measured",
      "amount_microusd": 100,
      "evidence_record_digest": "sha256:3333333333333333333333333333333333333333333333333333333333333333"
    },
    {
      "category": "human_labor",
      "status": "allocated",
      "amount_microusd": 40,
      "evidence_record_digest": "sha256:4444444444444444444444444444444444444444444444444444444444444444"
    },
    {
      "category": "escalation_rework",
      "status": "measured",
      "amount_microusd": 30,
      "evidence_record_digest": "sha256:5555555555555555555555555555555555555555555555555555555555555555"
    },
    {
      "category": "integration_support_amortization",
      "status": "estimated",
      "amount_microusd": 20,
      "evidence_record_digest": "sha256:6666666666666666666666666666666666666666666666666666666666666666"
    }
  ]
}
